{
  "chapter_id": "drone_foundry",
  "completion": {
    "mode": "all",
    "objective_ids": [
      "apply_fix",
      "tests_pass"
    ]
  },
  "difficulty": "introductory",
  "environment": {
    "schema_version": 1,
    "seed": 91,
    "template_id": "python.editor.fake.v1",
    "workspace": {
      "execution": {
        "fixtures": [
          {
            "id": "fixed",
            "match": {
              "file_contains": {
                "/workspace/drone.py": "battery_level = 10"
              }
            },
            "result": {
              "status": "completed",
              "tests": [
                {
                  "id": "test_solve",
                  "status": "passed"
                }
              ]
            }
          },
          {
            "id": "broken",
            "match": {
              "file_contains": {
                "/workspace/drone.py": "self.battery = 10"
              }
            },
            "result": {
              "status": "completed",
              "tests": [
                {
                  "id": "test_solve",
                  "message": "Behavior still incorrect",
                  "status": "failed"
                }
              ]
            }
          },
          {
            "id": "default_fail",
            "result": {
              "status": "completed",
              "tests": [
                {
                  "id": "test_solve",
                  "message": "Unexpected workspace state",
                  "status": "failed"
                }
              ]
            }
          }
        ],
        "provider": "fake"
      },
      "files": [
        {
          "content": "class Drone:\n    def __init__(self):\n        self.battery = 10\n\ndef solve() -> bool:\n    d = Drone()\n    return getattr(d, 'battery_level', None) == 10\n",
          "editable": true,
          "path": "/workspace/drone.py"
        },
        {
          "content": "from drone import solve\n\n\ndef test_solve():\n    assert solve() is True\n",
          "editable": false,
          "path": "/workspace/test_solve.py"
        }
      ]
    }
  },
  "hints": [
    {
      "level": 1,
      "text": "Prefer a battery_level API."
    },
    {
      "level": 2,
      "text": "Rename or wrap battery."
    },
    {
      "level": 3,
      "text": "Expose battery_level."
    },
    {
      "level": 4,
      "text": "Keep access safe."
    }
  ],
  "mission_id": "drone.encapsulate.01",
  "narrative": {
    "briefing_dialogue_id": "dialogue.drone.encapsulate.01.briefing",
    "success_dialogue_id": "dialogue.drone.encapsulate.01.success"
  },
  "objectives": [
    {
      "assert": {
        "file_contains:/workspace/drone.py": "battery_level = 10"
      },
      "description": "Apply the required Python fix.",
      "id": "apply_fix",
      "type": "file_assertion",
      "visible": true
    },
    {
      "assert": {
        "all_passed": "true",
        "test_count": "1"
      },
      "description": "Run tests and make them pass.",
      "id": "tests_pass",
      "type": "execution_tests",
      "visible": true
    }
  ],
  "requirements": {
    "app_version": ">=0.1.0",
    "online": false,
    "prerequisite_skills": []
  },
  "rewards": {
    "clearance_points": 35,
    "mastery": {
      "oop.encapsulation": 1
    },
    "unlocks": [
      "lore.drone.encapsulate.01"
    ]
  },
  "schema_version": 1,
  "skills": {
    "primary": "oop.encapsulation",
    "secondary": []
  },
  "summary": "Hide battery behind a safe accessor.",
  "title": "Encapsulate Battery",
  "tools": [
    "python_editor",
    "test_console"
  ],
  "version": "1.0.0"
}
