{
  "chapter_id": "reactor_kernel",
  "completion": {
    "mode": "all",
    "objective_ids": [
      "apply_fix",
      "tests_pass"
    ]
  },
  "difficulty": "challenge",
  "environment": {
    "schema_version": 1,
    "seed": 154,
    "template_id": "python.editor.fake.v1",
    "workspace": {
      "execution": {
        "fixtures": [
          {
            "id": "fixed",
            "match": {
              "file_contains": {
                "/workspace/thermal.py": "released = True"
              }
            },
            "result": {
              "status": "completed",
              "tests": [
                {
                  "id": "test_solve",
                  "status": "passed"
                }
              ]
            }
          },
          {
            "id": "broken",
            "match": {
              "file_contains": {
                "/workspace/thermal.py": "released = False"
              }
            },
            "result": {
              "status": "completed",
              "tests": [
                {
                  "id": "test_solve",
                  "message": "Behavior still incorrect",
                  "status": "failed"
                }
              ]
            }
          },
          {
            "id": "default_fail",
            "result": {
              "status": "completed",
              "tests": [
                {
                  "id": "test_solve",
                  "message": "Unexpected workspace state",
                  "status": "failed"
                }
              ]
            }
          }
        ],
        "provider": "fake"
      },
      "files": [
        {
          "content": "def solve() -> bool:\n    acquired = True\n    released = False\n    return acquired and released\n",
          "editable": true,
          "path": "/workspace/thermal.py"
        },
        {
          "content": "from thermal import solve\n\n\ndef test_solve():\n    assert solve() is True\n",
          "editable": false,
          "path": "/workspace/test_solve.py"
        }
      ]
    }
  },
  "hints": [
    {
      "level": 1,
      "text": "Release on scope exit."
    },
    {
      "level": 2,
      "text": "Call release()."
    },
    {
      "level": 3,
      "text": "RAII means automatic cleanup."
    },
    {
      "level": 4,
      "text": "Return true after release."
    }
  ],
  "mission_id": "cpp.raii_capstone.01",
  "narrative": {
    "briefing_dialogue_id": "dialogue.cpp.raii_capstone.01.briefing",
    "success_dialogue_id": "dialogue.cpp.raii_capstone.01.success"
  },
  "objectives": [
    {
      "assert": {
        "file_contains:/workspace/thermal.py": "released = True"
      },
      "description": "Apply the required C++ concept fix.",
      "id": "apply_fix",
      "type": "file_assertion",
      "visible": true
    },
    {
      "assert": {
        "all_passed": "true",
        "test_count": "1"
      },
      "description": "Run tests and make them pass.",
      "id": "tests_pass",
      "type": "execution_tests",
      "visible": true
    }
  ],
  "requirements": {
    "app_version": ">=0.1.0",
    "online": false,
    "prerequisite_skills": []
  },
  "rewards": {
    "clearance_points": 50,
    "mastery": {
      "cpp.raii": 1
    },
    "unlocks": [
      "lore.cpp.raii_capstone.01"
    ]
  },
  "schema_version": 1,
  "skills": {
    "primary": "cpp.raii",
    "secondary": []
  },
  "summary": "Ensure a resource guard releases on scope exit.",
  "title": "RAII Lifetime Fix",
  "tools": [
    "python_editor",
    "test_console"
  ],
  "version": "1.0.0"
}
