{
  "chapter_id": "reactor_kernel",
  "completion": {
    "mode": "all",
    "objective_ids": [
      "apply_fix",
      "tests_pass"
    ]
  },
  "difficulty": "introductory",
  "environment": {
    "schema_version": 1,
    "seed": 151,
    "template_id": "python.editor.fake.v1",
    "workspace": {
      "execution": {
        "fixtures": [
          {
            "id": "fixed",
            "match": {
              "file_contains": {
                "/workspace/thermal.py": "const"
              }
            },
            "result": {
              "status": "completed",
              "tests": [
                {
                  "id": "test_solve",
                  "status": "passed"
                }
              ]
            }
          },
          {
            "id": "broken",
            "match": {
              "file_contains": {
                "/workspace/thermal.py": "mutable"
              }
            },
            "result": {
              "status": "completed",
              "tests": [
                {
                  "id": "test_solve",
                  "message": "Behavior still incorrect",
                  "status": "failed"
                }
              ]
            }
          },
          {
            "id": "default_fail",
            "result": {
              "status": "completed",
              "tests": [
                {
                  "id": "test_solve",
                  "message": "Unexpected workspace state",
                  "status": "failed"
                }
              ]
            }
          }
        ],
        "provider": "fake"
      },
      "files": [
        {
          "content": "def solve() -> bool:\n    mode = 'mutable'\n    return mode == 'const'\n",
          "editable": true,
          "path": "/workspace/thermal.py"
        },
        {
          "content": "from thermal import solve\n\n\ndef test_solve():\n    assert solve() is True\n",
          "editable": false,
          "path": "/workspace/test_solve.py"
        }
      ]
    }
  },
  "hints": [
    {
      "level": 1,
      "text": "Use const int value."
    },
    {
      "level": 2,
      "text": "Read-only parameter."
    },
    {
      "level": 3,
      "text": "Add const."
    },
    {
      "level": 4,
      "text": "Run fixtures."
    }
  ],
  "mission_id": "cpp.const.01",
  "narrative": {
    "briefing_dialogue_id": "dialogue.cpp.const.01.briefing",
    "success_dialogue_id": "dialogue.cpp.const.01.success"
  },
  "objectives": [
    {
      "assert": {
        "file_contains:/workspace/thermal.py": "const"
      },
      "description": "Apply the required C++ concept fix.",
      "id": "apply_fix",
      "type": "file_assertion",
      "visible": true
    },
    {
      "assert": {
        "all_passed": "true",
        "test_count": "1"
      },
      "description": "Run tests and make them pass.",
      "id": "tests_pass",
      "type": "execution_tests",
      "visible": true
    }
  ],
  "requirements": {
    "app_version": ">=0.1.0",
    "online": false,
    "prerequisite_skills": []
  },
  "rewards": {
    "clearance_points": 35,
    "mastery": {
      "cpp.const": 1
    },
    "unlocks": [
      "lore.cpp.const.01"
    ]
  },
  "schema_version": 1,
  "skills": {
    "primary": "cpp.const",
    "secondary": []
  },
  "summary": "Mark a read-only parameter as const in a snippet.",
  "title": "Const Correctness",
  "tools": [
    "python_editor",
    "test_console"
  ],
  "version": "1.0.0"
}
