{
  "chapter_id": "automation_lab",
  "completion": {
    "mode": "all",
    "objective_ids": [
      "apply_fix",
      "tests_pass"
    ]
  },
  "difficulty": "introductory",
  "environment": {
    "schema_version": 1,
    "seed": 80,
    "template_id": "python.editor.fake.v1",
    "workspace": {
      "execution": {
        "fixtures": [
          {
            "id": "fixed",
            "match": {
              "file_contains": {
                "/workspace/solve.py": "int(value)"
              }
            },
            "result": {
              "status": "completed",
              "tests": [
                {
                  "id": "test_solve",
                  "status": "passed"
                }
              ]
            }
          },
          {
            "id": "broken",
            "match": {
              "file_contains": {
                "/workspace/solve.py": "return value == 7"
              }
            },
            "result": {
              "status": "completed",
              "tests": [
                {
                  "id": "test_solve",
                  "message": "Behavior still incorrect",
                  "status": "failed"
                }
              ]
            }
          },
          {
            "id": "default_fail",
            "result": {
              "status": "completed",
              "tests": [
                {
                  "id": "test_solve",
                  "message": "Unexpected workspace state",
                  "status": "failed"
                }
              ]
            }
          }
        ],
        "provider": "fake"
      },
      "files": [
        {
          "content": "def solve() -> bool:\n    value = \"7\"\n    return value == 7\n",
          "editable": true,
          "path": "/workspace/solve.py"
        },
        {
          "content": "from solve import solve\n\n\ndef test_solve():\n    assert solve() is True\n",
          "editable": false,
          "path": "/workspace/test_solve.py"
        }
      ]
    }
  },
  "hints": [
    {
      "level": 1,
      "text": "Return an int."
    },
    {
      "level": 2,
      "text": "Cast the value."
    },
    {
      "level": 3,
      "text": "Use int(value)."
    },
    {
      "level": 4,
      "text": "Run tests."
    }
  ],
  "mission_id": "automation.types.01",
  "narrative": {
    "briefing_dialogue_id": "dialogue.automation.types.01.briefing",
    "success_dialogue_id": "dialogue.automation.types.01.success"
  },
  "objectives": [
    {
      "assert": {
        "file_contains:/workspace/solve.py": "int(value)"
      },
      "description": "Apply the required Python fix.",
      "id": "apply_fix",
      "type": "file_assertion",
      "visible": true
    },
    {
      "assert": {
        "all_passed": "true",
        "test_count": "1"
      },
      "description": "Run tests and make them pass.",
      "id": "tests_pass",
      "type": "execution_tests",
      "visible": true
    }
  ],
  "requirements": {
    "app_version": ">=0.1.0",
    "online": false,
    "prerequisite_skills": []
  },
  "rewards": {
    "clearance_points": 35,
    "mastery": {
      "python.types": 1
    },
    "unlocks": [
      "lore.automation.types.01"
    ]
  },
  "schema_version": 1,
  "skills": {
    "primary": "python.types",
    "secondary": []
  },
  "summary": "Fix a type-sensitive threshold helper.",
  "title": "Values and Types",
  "tools": [
    "python_editor",
    "test_console"
  ],
  "version": "1.0.0"
}
