{
  "chapter_id": "automation_lab",
  "completion": {
    "mode": "all",
    "objective_ids": [
      "apply_fix",
      "tests_pass"
    ]
  },
  "difficulty": "introductory",
  "environment": {
    "schema_version": 1,
    "seed": 81,
    "template_id": "python.editor.fake.v1",
    "workspace": {
      "execution": {
        "fixtures": [
          {
            "id": "fixed",
            "match": {
              "file_contains": {
                "/workspace/solve.py": "for"
              }
            },
            "result": {
              "status": "completed",
              "tests": [
                {
                  "id": "test_solve",
                  "status": "passed"
                }
              ]
            }
          },
          {
            "id": "broken",
            "match": {
              "file_contains": {
                "/workspace/solve.py": "pass"
              }
            },
            "result": {
              "status": "completed",
              "tests": [
                {
                  "id": "test_solve",
                  "message": "Behavior still incorrect",
                  "status": "failed"
                }
              ]
            }
          },
          {
            "id": "default_fail",
            "result": {
              "status": "completed",
              "tests": [
                {
                  "id": "test_solve",
                  "message": "Unexpected workspace state",
                  "status": "failed"
                }
              ]
            }
          }
        ],
        "provider": "fake"
      },
      "files": [
        {
          "content": "def solve() -> bool:\n    total = 0\n    readings = [1, 2, 3]\n    pass\n    return total == 6\n",
          "editable": true,
          "path": "/workspace/solve.py"
        },
        {
          "content": "from solve import solve\n\n\ndef test_solve():\n    assert solve() is True\n",
          "editable": false,
          "path": "/workspace/test_solve.py"
        }
      ]
    }
  },
  "hints": [
    {
      "level": 1,
      "text": "Iterate readings."
    },
    {
      "level": 2,
      "text": "Add each value to total."
    },
    {
      "level": 3,
      "text": "Use a for loop."
    },
    {
      "level": 4,
      "text": "Ensure total == 6."
    }
  ],
  "mission_id": "automation.loops.01",
  "narrative": {
    "briefing_dialogue_id": "dialogue.automation.loops.01.briefing",
    "success_dialogue_id": "dialogue.automation.loops.01.success"
  },
  "objectives": [
    {
      "assert": {
        "file_contains:/workspace/solve.py": "for"
      },
      "description": "Apply the required Python fix.",
      "id": "apply_fix",
      "type": "file_assertion",
      "visible": true
    },
    {
      "assert": {
        "all_passed": "true",
        "test_count": "1"
      },
      "description": "Run tests and make them pass.",
      "id": "tests_pass",
      "type": "execution_tests",
      "visible": true
    }
  ],
  "requirements": {
    "app_version": ">=0.1.0",
    "online": false,
    "prerequisite_skills": [
      "python.conditionals"
    ]
  },
  "rewards": {
    "clearance_points": 35,
    "mastery": {
      "python.loops": 1
    },
    "unlocks": [
      "lore.automation.loops.01"
    ]
  },
  "schema_version": 1,
  "skills": {
    "primary": "python.loops",
    "secondary": []
  },
  "summary": "Sum sensor readings with a loop.",
  "title": "Loop the Sensors",
  "tools": [
    "python_editor",
    "test_console"
  ],
  "version": "1.0.0"
}
